{"authorization":"none","blockers":["Independent executor review has not signed off; this return covers packaging only.","No verified non-production staging host; end-to-end supervisor PASS remains NOT RUN.","CLIENT-PILOT-001 gates 1 to 3 unresolved; pairing path b approval outstanding."],"changed_paths":["docs/agent-handoffs/harness/TREE-MANIFEST.json"],"checks":[{"evidence_ref":"docs/agent-handoffs/harness/TREE-MANIFEST.json","name":"Strict verifier on committed package before fix","result":"FAIL","summary":"Fresh clone at 358e01e7: verify-tree exit 2 with exactly the five historical REGRESSION-RESULTS logs reported as EXTRA-FILE. Finding reproduced independently before any change."},{"evidence_ref":"docs/agent-handoffs/harness/TREE-MANIFEST.json","name":"Strict verifier on reconciled package","result":"PASS","summary":"Fresh clone at source.commit: verify-tree exit 0, OK 26 files. Git tree audit shows exactly eleven 100755 entries matching the manifest executable flags one for one."},{"evidence_ref":"docs/agent-handoffs/returns/from-muse-rev10-package-reconciliation-return.md","name":"Full regression replay on committed package content","result":"PASS","summary":"67 passed, 0 failed, including H3 strict-set and H4 shipped-manifest cases, on the committed content with Git modes applied. Stubbed happy path still aggregates BLOCKED by design; real-host PASS NOT RUN."},{"evidence_ref":"docs/agent-handoffs/CONSTRUCTION_START.md","name":"Supporting package validation at construction snapshot","result":"PASS","summary":"At 86bf3714: agent-return tests 12 OK, example sidecar validates, check-agent-workflow 17 tests OK exit 0. These validate the coordination package, not the harness or a live host."},{"evidence_ref":"docs/agent-handoffs/returns/from-muse-rev10-package-reconciliation.agent-return.json","name":"Evidence sidecar schema validation","result":"PASS","summary":"This sidecar passed scripts/validate-agent-return.py from the construction snapshot before filing."}],"next_action":"Codex reviews the reconciled exact package and dispositions the P07 clarification delta; Arch binds an accepted exact executor later.","next_owner":"codex","producer":"muse","schema_version":1,"scope_summary":"Rev 10 exact-package reconciliation: five historical result logs intentionally manifested with true digests, eleven-executable count corrected, committed package strict-verified and the 67-case suite replayed on committed content. P07 clarification delta filed. Execution held.","source":{"branch":"codex/staging-coordination","commit":"6dbd3c16399e66b1b86abe3026608113fc0bd018","repository":"quintwilliams84-bot/QA11lylabs"},"task_id":"customer-path-integration-scope"}